{
  "locale": "en",
  "version": "UX001",
  "strings": {
    "home.title": "Campaign",
    "home.play": "Start expedition",
    "home.resume": "Resume expedition",
    "home.army": "Army",
    "home.shop": "Shop",
    "home.settings": "Settings",
    "campaign.locked": "Complete {expedition} to unlock.",
    "campaign.complete": "Campaign complete. Replay any expedition with a different army.",
    "army.title": "Choose your army",
    "army.equipped": "{count}/4 equipped",
    "army.need_four": "Equip four different troops.",
    "army.equip": "Equip",
    "army.unequip": "Unequip",
    "army.locked": "Unlock for {medals} Medals",
    "army.unlock": "Unlock",
    "army.no_medals": "Not enough Medals.",
    "army.run_locked": "Your army is fixed for this expedition.",
    "briefing.title": "Expedition briefing",
    "briefing.battles": "Four battles. Choose an upgrade before each.",
    "briefing.enemy": "Enemy formation",
    "briefing.boss": "Stronghold defender: {boss}",
    "briefing.start": "Choose starting upgrade",
    "battle.supply": "Supply",
    "battle.base": "Your fortress",
    "battle.enemy_base": "Enemy fortress",
    "battle.army_full": "Army full: 24/24",
    "battle.no_supply": "Need {supply} Supply",
    "battle.cooldown": "Deploying…",
    "battle.rally": "Rally",
    "battle.rally_ready": "Ready",
    "battle.rally_active": "Rally active",
    "battle.rally_wait": "{seconds}s",
    "battle.overtime": "Overtime: fortress damage doubled",
    "battle.end_time": "Battle ends in {seconds}s",
    "tutorial.front": "Deploy a Shieldguard to protect your army.",
    "tutorial.ranged": "Deploy a Crossbowman behind your frontline.",
    "tutorial.rally": "Use Rally to speed up your army’s attacks.",
    "tutorial.skip": "Skip guidance",
    "tutorial.next": "Continue",
    "draft.title": "Choose an upgrade",
    "draft.pick": "Choose",
    "draft.progress": "Upgrade {number}/4",
    "draft.free_reroll": "Free reroll",
    "draft.ad_reroll": "Watch an ad for one reroll",
    "draft.owned_reroll": "Use extra reroll",
    "draft.no_rerolls": "No rerolls left this expedition",
    "draft.ad_unavailable": "Ad unavailable. Choose an upgrade or retry later.",
    "results.win": "Victory",
    "results.loss": "Defeat",
    "results.draw": "Draw",
    "results.expedition_win": "Expedition complete",
    "results.banked": "{medals} Medals saved",
    "results.bonus": "Watch an ad for +{medals} Medals",
    "results.owned_bonus": "Claim +{medals} Medals",
    "results.claimed": "Bonus claimed",
    "results.continue": "Continue",
    "results.retry": "Try expedition again",
    "results.home": "Return to campaign",
    "results.last_battle": "Rewards from earlier wins are already saved.",
    "pause.title": "Paused",
    "pause.resume": "Resume",
    "pause.home": "Return to campaign",
    "pause.abandon": "Abandon expedition",
    "pause.save_notice": "A closed app restarts this battle from its beginning.",
    "abandon.title": "Abandon this expedition?",
    "abandon.body": "Your {medals} banked Medals stay saved. This army build and unfinished battle will be lost.",
    "abandon.confirm": "Abandon",
    "abandon.cancel": "Keep expedition",
    "shop.title": "Shop",
    "shop.adfree": "Ad-free Bonuses",
    "shop.adfree_body": "Claim the extra expedition reroll and eligible Medal bonus without watching ads. The usual limits still apply. Medal bonuses end when all Medal unlocks are owned. The free game has no forced ads.",
    "shop.adfree_exhausted": "Claim one extra reroll per expedition without an ad. You already own every Medal unlock, so Medal bonuses are no longer offered. The free game has no forced ads.",
    "shop.cosmetic": "Cosmetic Army Pack",
    "shop.cosmetic_body": "One coordinated banner, shield marking, fortress trim and equipment-accent set. No combat advantage.",
    "shop.buy": "Buy · {price}",
    "shop.owned": "Owned",
    "shop.restore": "Restore purchases",
    "shop.preview": "Preview",
    "shop.no_price": "Store unavailable",
    "shop.network": "An internet connection is needed to purchase or restore.",
    "purchase.pending": "Payment pending. Benefits unlock after the store confirms payment.",
    "purchase.verifying": "Verifying purchase…",
    "purchase.success": "Purchase restored or completed. Benefits are available.",
    "purchase.cancelled": "Purchase cancelled. No benefit was added.",
    "purchase.failed": "Purchase could not be completed. Check the store and try again.",
    "purchase.recovering": "Purchase received. Verification will retry when connected. Do not buy it again.",
    "purchase.restore_none": "No owned products were returned by this store account.",
    "purchase.revoked": "The store reports this purchase is no longer owned. Contact support for purchase issues.",
    "settings.title": "Settings",
    "settings.music": "Music",
    "settings.sfx": "Sound effects",
    "settings.ui": "Interface sounds",
    "settings.haptics": "Vibration",
    "settings.motion": "Reduced motion",
    "settings.flashes": "Reduced flashes",
    "settings.privacy": "Privacy choices",
    "settings.support": "Support",
    "settings.reset": "Reset local progress",
    "settings.build": "Version {version} · {balance}",
    "save.failed": "Progress could not be saved. Free device storage and retry. Your last valid save has been kept.",
    "save.retry": "Retry saving",
    "save.backup": "Your backup save was recovered. The most recent unsaved action may be missing.",
    "save.unreadable": "Neither local save could be read. No automatic reset was performed.",
    "save.newer": "This save was created by a newer game version. Update the app; your save has not been replaced.",
    "save.local_notice": "Progress is stored on this device only. Reinstalling or changing devices may lose progress. Purchases can be restored separately.",
    "reset.title": "Reset local progress?",
    "reset.body": "Campaign progress, Medals, troop unlocks, earned banners and the current expedition will be erased. Purchases and privacy settings remain. This cannot be undone.",
    "reset.confirm": "Reset progress",
    "reset.cancel": "Cancel",
    "service.offline": "Offline. Battles and saved progress remain available.",
    "service.retry": "Retry",
    "service.close": "Close",
    "privacy.notice": "Manage advertising and data choices. These choices do not block ordinary gameplay.",
    "support.missing": "Support information is not configured in this development build.",
    "reward.processing": "Saving your earned reward…",
    "reward.failed": "Your reward receipt is saved, but the grant could not be saved yet. Retry saving; do not watch another ad for this claim.",
    "unit.hp": "Health",
    "unit.damage": "Troop damage",
    "unit.base_damage": "Fortress damage",
    "unit.period": "Attack interval",
    "unit.range": "Range",
    "unit.speed": "Movement",
    "unit.cost": "Supply cost",
    "unit.reduction": "Damage reduction",
    "general.back": "Back",
    "general.confirm": "Confirm",
    "general.cancel": "Cancel",
    "general.on": "On",
    "general.off": "Off",
    "unit.militia.name": "Militia",
    "unit.shieldguard.name": "Shieldguard",
    "unit.crossbowman.name": "Crossbowman",
    "unit.grenadier.name": "Grenadier",
    "unit.brute.name": "Brute",
    "unit.ram.name": "Battering Ram",
    "upgrade.u01.title": "Conscription",
    "upgrade.u01.body": "Every fifth paid Militia deployment grants one additional Militia. Bonus spawns do not increment this counter.",
    "upgrade.u02.title": "Scrap Blades",
    "upgrade.u02.body": "Militia damage +25%, including base damage.",
    "upgrade.u03.title": "Thick Coats",
    "upgrade.u03.body": "Militia maximum HP +25%.",
    "upgrade.u04.title": "First Into Battle",
    "upgrade.u04.body": "Shieldguard carries a barrier worth 30% of modified maximum HP. Its 8-second lifetime begins on the first positive incoming damage, absorbing that hit. One activation per unit.",
    "upgrade.u05.title": "Reinforced Shields",
    "upgrade.u05.body": "Shieldguard flat damage reduction increases by 2.",
    "upgrade.u06.title": "Heavy Boots",
    "upgrade.u06.body": "Shieldguard maximum HP +30%; movement speed -10%.",
    "upgrade.u07.title": "Piercing Bolts",
    "upgrade.u07.body": "A bolt may hit one additional enemy behind the first for 60% of the original bolt damage.",
    "upgrade.u08.title": "Tighter Windlass",
    "upgrade.u08.body": "Crossbowman damage +25%.",
    "upgrade.u09.title": "Quick Reload",
    "upgrade.u09.body": "Crossbowman attack rate +20%.",
    "upgrade.u10.title": "Packed Powder",
    "upgrade.u10.body": "Grenadier explosion radius +50%.",
    "upgrade.u11.title": "Heavy Charges",
    "upgrade.u11.body": "Grenadier damage +25%.",
    "upgrade.u12.title": "Fast Fuses",
    "upgrade.u12.body": "Grenadier attack rate +20%. Projectile travel is unchanged.",
    "upgrade.u13.title": "Sweeping Club",
    "upgrade.u13.body": "Brute strikes also hit the nearest two additional enemy units within 0.8m of the primary target for 40% damage.",
    "upgrade.u14.title": "Iron Belly",
    "upgrade.u14.body": "Brute maximum HP +25%.",
    "upgrade.u15.title": "Brutal Force",
    "upgrade.u15.body": "Brute damage +25%.",
    "upgrade.u16.title": "Splintering Head",
    "upgrade.u16.body": "Every third landed Ram hit on an enemy base deals an additional 100% of that hit’s direct damage to the base.",
    "upgrade.u17.title": "Siege Engineering",
    "upgrade.u17.body": "Ram base damage +35%; Supply cost +15%.",
    "upgrade.u18.title": "Reinforced Frame",
    "upgrade.u18.body": "Ram maximum HP +25%.",
    "upgrade.u19.title": "War Economy",
    "upgrade.u19.body": "Supply regeneration +15%.",
    "upgrade.u20.title": "Deep Stores",
    "upgrade.u20.body": "Supply capacity +50 and starting Supply +25 each battle.",
    "upgrade.u21.title": "War Drums",
    "upgrade.u21.body": "Rally duration +2 seconds.",